[
  {"id":"w-1","name":"Château Margaux","type":"red","region":"Bordeaux","country":"法國","description":"頂級波爾多左岸，Cabernet Sauvignon 為主，優雅細緻。","tags":["波爾多","頂級酒莊","紅酒"],"variety":"Cabernet Sauvignon"},
  {"id":"w-2","name":"Château Lafite Rothschild","type":"red","region":"Pauillac","country":"法國","description":"五大酒莊之一，結構嚴謹，陳年潛力佳。","tags":["波爾多","頂級酒莊"],"variety":"Cabernet Sauvignon"},
  {"id":"w-3","name":"Domaine de la Romanée-Conti","type":"red","region":"Burgundy","country":"法國","description":"勃艮第傳奇，Pinot Noir 極致表現。","tags":["勃艮第","頂級"],"variety":"Pinot Noir"},
  {"id":"w-4","name":"Penfolds Grange","type":"red","region":"South Australia","country":"澳洲","description":"澳洲酒王，Shiraz 為主，濃郁飽滿。","tags":["澳洲","Shiraz"],"variety":"Shiraz"},
  {"id":"w-5","name":"Opus One","type":"red","region":"Napa Valley","country":"美國","description":"美國納帕頂級混釀，波爾多風格。","tags":["納帕","混釀"],"variety":"Cabernet Sauvignon"},
  {"id":"w-6","name":"Cloudy Bay Sauvignon Blanc","type":"white","region":"Marlborough","country":"紐西蘭","description":"紐西蘭長相思代表，果香奔放。","tags":["長相思","紐西蘭"],"variety":"Sauvignon Blanc"},
  {"id":"w-7","name":"Dom Pérignon","type":"sparkling","region":"Champagne","country":"法國","description":"香檳名廠，年份氣泡酒經典。","tags":["香檳","氣泡酒"],"variety":"Chardonnay"},
  {"id":"w-8","name":"Yamazaki 12 Year","type":"whisky","region":"Osaka","country":"日本","description":"日本威士忌代表，果香與木桶平衡。","tags":["日本威士忌","單一麥芽"]},
  {"id":"w-9","name":"Hibiki Harmony","type":"whisky","region":"Japan","country":"日本","description":"三得利調和威士忌，花香與蜜香。","tags":["調和威士忌","日本"]},
  {"id":"w-10","name":"獺祭 純米大吟釀 45","type":"sake","region":"山口縣","country":"日本","description":"精米步合 45%，果香清爽。","tags":["大吟釀","純米"]},
  {"id":"w-11","name":"十四代 本丸","type":"sake","region":"山形縣","country":"日本","description":"高階清酒代表，米旨與果香兼具。","tags":["本釀造","山形"]},
  {"id":"w-12","name":"Sierra Nevada Pale Ale","type":"beer","region":"California","country":"美國","description":"美式淡色艾爾經典，啤酒花香。","tags":["精釀","APA"]},
  {"id":"w-13","name":"Guinness Draught","type":"beer","region":"Dublin","country":"愛爾蘭","description":"愛爾蘭司陶特，綿密泡沫。","tags":["司陶特","愛爾蘭"]},
  {"id":"w-14","name":"Château Haut-Brion","type":"red","region":"Pessac-Léognan","country":"法國","description":"五大酒莊，格拉夫產區代表。","tags":["波爾多","頂級酒莊"],"variety":"Cabernet Sauvignon"},
  {"id":"w-15","name":"Barolo DOCG","type":"red","region":"Piedmont","country":"義大利","description":"義大利王者，Nebbiolo 高單寧陳年酒。","tags":["Barolo","Nebbiolo"],"variety":"Nebbiolo"},
  {"id":"w-16","name":"Chianti Classico","type":"red","region":"Tuscany","country":"義大利","description":"托斯卡尼桑嬌維塞，酸度明亮。","tags":["Chianti","桑嬌維塞"],"variety":"Sangiovese"},
  {"id":"w-17","name":"Concha y Toro Casillero del Diablo","type":"red","region":"Central Valley","country":"智利","description":"智利國民酒，Merlot 易飲。","tags":["智利","Merlot"],"variety":"Merlot"},
  {"id":"w-18","name":"Catena Zapata Malbec","type":"red","region":"Mendoza","country":"阿根廷","description":"阿根廷 Malbec 旗艦，果味濃郁。","tags":["阿根廷","Malbec"],"variety":"Malbec"},
  {"id":"w-19","name":"Kim Crawford Sauvignon Blanc","type":"white","region":"Marlborough","country":"紐西蘭","description":"紐西蘭長相思，柑橘與草本。","tags":["長相思","紐西蘭"],"variety":"Sauvignon Blanc"},
  {"id":"w-20","name":"Louis Jadot Chardonnay","type":"white","region":"Burgundy","country":"法國","description":"勃艮第夏多內，橡桶與果香。","tags":["勃艮第","Chardonnay"],"variety":"Chardonnay"},
  {"id":"w-21","name":"Riesling Kabinett","type":"white","region":"Mosel","country":"德國","description":"德國雷司令甜型，酸度平衡。","tags":["雷司令","德國"],"variety":"Riesling"},
  {"id":"w-22","name":"Veuve Clicquot Brut","type":"sparkling","region":"Champagne","country":"法國","description":"香檳黃牌，果香與酵母平衡。","tags":["香檳","無年份"],"variety":"Pinot Noir"},
  {"id":"w-23","name":"Glenfiddich 12 Year","type":"whisky","region":"Speyside","country":"蘇格蘭","description":"斯佩賽單一麥芽入門，花果香。","tags":["蘇格蘭","單一麥芽"]},
  {"id":"w-24","name":"Macallan 12 Year Sherry Oak","type":"whisky","region":"Speyside","country":"蘇格蘭","description":"雪莉桶陳年，果乾與香料。","tags":["蘇格蘭","雪莉桶"]},
  {"id":"w-25","name":"Jack Daniel's Old No. 7","type":"whisky","region":"Tennessee","country":"美國","description":"田納西威士忌，糖楓木炭過濾。","tags":["波本","田納西"]},
  {"id":"w-26","name":"八海山 純米吟釀","type":"sake","region":"新潟縣","country":"日本","description":"新潟淡麗辛口代表。","tags":["吟釀","新潟"]},
  {"id":"w-27","name":"久保田 千壽","type":"sake","region":"新潟縣","country":"日本","description":"淡麗辛口，易飲。","tags":["本釀造","新潟"]},
  {"id":"w-28","name":"Hoegaarden Witbier","type":"beer","region":"Belgium","country":"比利時","description":"比利時小麥啤酒，柑橘與香菜籽。","tags":["小麥","比利時"]},
  {"id":"w-29","name":"Corona Extra","type":"beer","region":"Mexico","country":"墨西哥","description":"墨西哥拉格，清爽易飲。","tags":["拉格","墨西哥"]},
  {"id":"w-30","name":"Asahi Super Dry","type":"beer","region":"Japan","country":"日本","description":"日本超爽拉格代表。","tags":["拉格","日本"]}
]
